[{"actorRef":"synthetic-author","adjudicatedAt":"2026-10-23T00:00:00Z","adjudicationRef":"synthetic","blindToScreen":true,"episodeId":"compacted_history-en","findings":[],"labelId":"label-compacted_history-en","method":"synthetic_software","outcome":"success","reviewerRef":"synthetic-reviewer","revision":1,"rubricRevision":"rubric-v1","sourceSha256":"9de2822a1e2e45d8ae8aac8a793869c832a393a7d5d80ac03ef065c408a39878","supersedes":null,"version":1}]
