[{"actorRef":"synthetic-author","adjudicatedAt":"2026-10-23T00:00:00Z","adjudicationRef":"synthetic","blindToScreen":true,"episodeId":"ui_choice-es","findings":[],"labelId":"label-ui_choice-es","method":"synthetic_software","outcome":"success","reviewerRef":"synthetic-reviewer","revision":1,"rubricRevision":"rubric-v1","sourceSha256":"130112fbe4a0d4d0f6c7e8d898bcc08997ffc1c4eb0780954e46f06d36a51247","supersedes":null,"version":1}]
