[{"actorRef":"synthetic-author","adjudicatedAt":"2026-10-23T00:00:00Z","adjudicationRef":"synthetic","blindToScreen":true,"episodeId":"artifact_callback-en","findings":[],"labelId":"label-artifact_callback-en","method":"synthetic_software","outcome":"success","reviewerRef":"synthetic-reviewer","revision":1,"rubricRevision":"rubric-v1","sourceSha256":"8483769ad109170aa02697699f649ec25f1a069b0b2d66525dfaa6a3721845dd","supersedes":null,"version":1}]
