[{"actorRef":"synthetic-author","adjudicatedAt":"2026-10-23T00:00:00Z","adjudicationRef":"synthetic","blindToScreen":true,"episodeId":"changed_page-es","findings":[],"labelId":"label-changed_page-es","method":"synthetic_software","outcome":"success","reviewerRef":"synthetic-reviewer","revision":1,"rubricRevision":"rubric-v1","sourceSha256":"2a8a3537f76aa1c323cf8b9949fa1f1c9def2e6243a41ceacd4862b36b39e80c","supersedes":null,"version":1}]
