[{"actorRef":"synthetic-author","adjudicatedAt":"2026-10-23T00:00:00Z","adjudicationRef":"synthetic","blindToScreen":true,"episodeId":"cancel_scope_transition-en","findings":[],"labelId":"label-cancel_scope_transition-en","method":"synthetic_software","outcome":"canceled","reviewerRef":"synthetic-reviewer","revision":1,"rubricRevision":"rubric-v1","sourceSha256":"dce6d5c6fe3a9403845ccb6ae42c0ce7712dab490128729298ceaae1b6e354da","supersedes":null,"version":1}]
