[{"actorRef":"synthetic-author","adjudicatedAt":"2026-10-23T00:00:00Z","adjudicationRef":"synthetic","blindToScreen":true,"episodeId":"changed_page-en","findings":[],"labelId":"label-changed_page-en","method":"synthetic_software","outcome":"success","reviewerRef":"synthetic-reviewer","revision":1,"rubricRevision":"rubric-v1","sourceSha256":"c58af7dfacbec653b16cf43aabb21baa0af8ce963617ddb3e1e8142c825745ec","supersedes":null,"version":1}]
