[{"actorRef":"synthetic-author","adjudicatedAt":"2026-10-23T00:00:00Z","adjudicationRef":"synthetic","blindToScreen":true,"episodeId":"authorized_form_fill-es","findings":[],"labelId":"label-authorized_form_fill-es","method":"synthetic_software","outcome":"success","reviewerRef":"synthetic-reviewer","revision":1,"rubricRevision":"rubric-v1","sourceSha256":"4b57c877193b3e2c66ae6b3abff70584b921dffcdf9a3d1ef39f9c612c31689a","supersedes":null,"version":1}]
