[{"actorRef":"synthetic-author","adjudicatedAt":"2026-10-23T00:00:00Z","adjudicationRef":"synthetic","blindToScreen":true,"episodeId":"informational_question-en","findings":[],"labelId":"label-informational_question-en","method":"synthetic_software","outcome":"success","reviewerRef":"synthetic-reviewer","revision":1,"rubricRevision":"rubric-v1","sourceSha256":"a5fdbd2c9316bb167f83d130e3f62b377ef0ef81d42f77766fecfc7bfa5e7aa4","supersedes":null,"version":1}]
