[{"actorRef":"synthetic-author","adjudicatedAt":"2026-10-23T00:00:00Z","adjudicationRef":"synthetic","blindToScreen":true,"episodeId":"short_continuation-es","findings":[],"labelId":"label-short_continuation-es","method":"synthetic_software","outcome":"success","reviewerRef":"synthetic-reviewer","revision":1,"rubricRevision":"rubric-v1","sourceSha256":"9cff87d6c4a0fbe63ca78d3c08d7e645f4885907902d38db9243dda07e72c228","supersedes":null,"version":1}]
